aana/tests/files/gemlite/qwen_3b_vl_config.json
{"GEMV": {}, "GEMV_REVSPLITK": {"(1, 2560, 2048, 64, 8)": {"BLOCK_SIZE_M": 1, "BLOCK_SIZE_N": 256, "BLOCK_SIZE_K": 16, "A_load_order": 1, "meta_evict_policy": "", "atomic_mode": "relaxed", "dot_prod_mode": 0, "num_warps": 2, "num_ctas": 1, "num_stages": 1, "num_buffers_warp_spec": 0, "num_consumer_groups": 0, "reg_dec_producer": 0, "reg_inc_consumer": 0}, "(1, 2048, 2048, 64, 8)": {"BLOCK_SIZE_M": 1, "BLOCK_SIZE_N": 128, "BLOCK_SIZE_K": 16, "A_load_order": 0, "meta_evict_policy": "", "atomic_mode": "relaxed", "dot_prod_mode": 0, "num_warps": 2, "num_ctas": 1, "num_stages": 1, "num_buffers_warp_spec": 0, "num_consumer_groups": 0, "reg_dec_producer": 0, "reg_inc_consumer": 0}, "(1, 22016, 2048, 64, 8)": {"BLOCK_SIZE_M": 1, "BLOCK_SIZE_N": 128, "BLOCK_SIZE_K": 32, "A_load_order": 0, "meta_evict_policy": "", "atomic_mode": "relaxed", "dot_prod_mode": 0, "num_warps": 2, "num_ctas": 1, "num_stages": 1, "num_buffers_warp_spec": 0, "num_consumer_groups": 0, "reg_dec_producer": 0, "reg_inc_consumer": 0}, "(1, 2048, 11008, 64, 8)": {"BLOCK_SIZE_M": 1, "BLOCK_SIZE_N": 128, "BLOCK_SIZE_K": 32, "A_load_order": 0, "meta_evict_policy": "", "atomic_mode": "relaxed", "dot_prod_mode": 0, "num_warps": 2, "num_ctas": 1, "num_stages": 1, "num_buffers_warp_spec": 0, "num_consumer_groups": 0, "reg_dec_producer": 0, "reg_inc_consumer": 0}}, "GEMV_SPLITK": {}, "GEMM_SPLITK": {"(64, 2560, 2048, 64, 8)": {"BLOCK_SIZE_M": 32, "BLOCK_SIZE_N": 64, "BLOCK_SIZE_K": 64, "GROUP_SIZE_M": 8, "SPLIT_K": 4, "A_load_order": 2, "meta_evict_policy": "", "atomic_mode": "relaxed", "num_warps": 4, "num_ctas": 1, "num_stages": 1, "num_buffers_warp_spec": 0, "num_consumer_groups": 0, "reg_dec_producer": 0, "reg_inc_consumer": 0}, "(64, 2048, 2048, 64, 8)": {"BLOCK_SIZE_M": 32, "BLOCK_SIZE_N": 64, "BLOCK_SIZE_K": 64, "GROUP_SIZE_M": 8, "SPLIT_K": 4, "A_load_order": 2, "meta_evict_policy": "", "atomic_mode": "relaxed", "num_warps": 4, "num_ctas": 1, "num_stages": 1, "num_buffers_warp_spec": 0, "num_consumer_groups": 0, "reg_dec_producer": 0, "reg_inc_consumer": 0}, "(64, 22016, 2048, 64, 8)": {"BLOCK_SIZE_M": 32, "BLOCK_SIZE_N": 64, "BLOCK_SIZE_K": 64, "GROUP_SIZE_M": 8, "SPLIT_K": 1, "A_load_order": 2, "meta_evict_policy": "", "atomic_mode": "relaxed", "num_warps": 4, "num_ctas": 1, "num_stages": 1, "num_buffers_warp_spec": 0, "num_consumer_groups": 0, "reg_dec_producer": 0, "reg_inc_consumer": 0}, "(64, 2048, 11008, 64, 8)": {"BLOCK_SIZE_M": 32, "BLOCK_SIZE_N": 64, "BLOCK_SIZE_K": 32, "GROUP_SIZE_M": 8, "SPLIT_K": 8, "A_load_order": 2, "meta_evict_policy": "", "atomic_mode": "relaxed", "num_warps": 4, "num_ctas": 1, "num_stages": 1, "num_buffers_warp_spec": 0, "num_consumer_groups": 0, "reg_dec_producer": 0, "reg_inc_consumer": 0}, "(32, 2560, 2048, 64, 8)": {"BLOCK_SIZE_M": 32, "BLOCK_SIZE_N": 64, "BLOCK_SIZE_K": 64, "GROUP_SIZE_M": 8, "SPLIT_K": 8, "A_load_order": 2, "meta_evict_policy": "", "atomic_mode": "relaxed", "num_warps": 4, "num_ctas": 1, "num_stages": 1, "num_buffers_warp_spec": 0, "num_consumer_groups": 0, "reg_dec_producer": 0, "reg_inc_consumer": 0}, "(32, 2048, 2048, 64, 8)": {"BLOCK_SIZE_M": 32, "BLOCK_SIZE_N": 64, "BLOCK_SIZE_K": 64, "GROUP_SIZE_M": 8, "SPLIT_K": 8, "A_load_order": 2, "meta_evict_policy": "", "atomic_mode": "relaxed", "num_warps": 4, "num_ctas": 1, "num_stages": 1, "num_buffers_warp_spec": 0, "num_consumer_groups": 0, "reg_dec_producer": 0, "reg_inc_consumer": 0}, "(32, 22016, 2048, 64, 8)": {"BLOCK_SIZE_M": 32, "BLOCK_SIZE_N": 64, "BLOCK_SIZE_K": 64, "GROUP_SIZE_M": 8, "SPLIT_K": 1, "A_load_order": 2, "meta_evict_policy": "", "atomic_mode": "relaxed", "num_warps": 4, "num_ctas": 1, "num_stages": 1, "num_buffers_warp_spec": 0, "num_consumer_groups": 0, "reg_dec_producer": 0, "reg_inc_consumer": 0}, "(32, 2048, 11008, 64, 8)": {"BLOCK_SIZE_M": 32, "BLOCK_SIZE_N": 64, "BLOCK_SIZE_K": 32, "GROUP_SIZE_M": 8, "SPLIT_K": 8, "A_load_order": 2, "meta_evict_policy": "", "atomic_mode": "relaxed", "num_warps": 8, "num_ctas": 1, "num_stages": 1, "num_buffers_warp_spec": 0, "num_consumer_groups": 0, "reg_dec_producer": 0, "reg_inc_consumer": 0}, "(16, 2560, 2048, 64, 8)": {"BLOCK_SIZE_M": 16, "BLOCK_SIZE_N": 64, "BLOCK_SIZE_K": 64, "GROUP_SIZE_M": 8, "SPLIT_K": 8, "A_load_order": 0, "meta_evict_policy": "", "atomic_mode": "relaxed", "num_warps": 8, "num_ctas": 1, "num_stages": 1, "num_buffers_warp_spec": 0, "num_consumer_groups": 0, "reg_dec_producer": 0, "reg_inc_consumer": 0}, "(16, 2048, 2048, 64, 8)": {"BLOCK_SIZE_M": 16, "BLOCK_SIZE_N": 64, "BLOCK_SIZE_K": 64, "GROUP_SIZE_M": 8, "SPLIT_K": 16, "A_load_order": 2, "meta_evict_policy": "", "atomic_mode": "relaxed", "num_warps": 4, "num_ctas": 1, "num_stages": 1, "num_buffers_warp_spec": 0, "num_consumer_groups": 0, "reg_dec_producer": 0, "reg_inc_consumer": 0}, "(16, 22016, 2048, 64, 8)": {"BLOCK_SIZE_M": 16, "BLOCK_SIZE_N": 64, "BLOCK_SIZE_K": 64, "GROUP_SIZE_M": 8, "SPLIT_K": 8, "A_load_order": 2, "meta_evict_policy": "", "atomic_mode": "relaxed", "num_warps": 4, "num_ctas": 1, "num_stages": 1, "num_buffers_warp_spec": 0, "num_consumer_groups": 0, "reg_dec_producer": 0, "reg_inc_consumer": 0}, "(16, 2048, 11008, 64, 8)": {"BLOCK_SIZE_M": 16, "BLOCK_SIZE_N": 32, "BLOCK_SIZE_K": 32, "GROUP_SIZE_M": 8, "SPLIT_K": 8, "A_load_order": 2, "meta_evict_policy": "", "atomic_mode": "relaxed", "num_warps": 4, "num_ctas": 1, "num_stages": 1, "num_buffers_warp_spec": 0, "num_consumer_groups": 0, "reg_dec_producer": 0, "reg_inc_consumer": 0}, "(8, 2560, 2048, 64, 8)": {"BLOCK_SIZE_M": 16, "BLOCK_SIZE_N": 64, "BLOCK_SIZE_K": 64, "GROUP_SIZE_M": 8, "SPLIT_K": 16, "A_load_order": 2, "meta_evict_policy": "", "atomic_mode": "relaxed", "num_warps": 4, "num_ctas": 1, "num_stages": 1, "num_buffers_warp_spec": 0, "num_consumer_groups": 0, "reg_dec_producer": 0, "reg_inc_consumer": 0}, "(8, 2048, 2048, 64, 8)": {"BLOCK_SIZE_M": 16, "BLOCK_SIZE_N": 64, "BLOCK_SIZE_K": 64, "GROUP_SIZE_M": 8, "SPLIT_K": 16, "A_load_order": 2, "meta_evict_policy": "", "atomic_mode": "relaxed", "num_warps": 4, "num_ctas": 1, "num_stages": 1, "num_buffers_warp_spec": 0, "num_consumer_groups": 0, "reg_dec_producer": 0, "reg_inc_consumer": 0}, "(8, 22016, 2048, 64, 8)": {"BLOCK_SIZE_M": 16, "BLOCK_SIZE_N": 64, "BLOCK_SIZE_K": 64, "GROUP_SIZE_M": 8, "SPLIT_K": 16, "A_load_order": 2, "meta_evict_policy": "", "atomic_mode": "relaxed", "num_warps": 4, "num_ctas": 1, "num_stages": 1, "num_buffers_warp_spec": 0, "num_consumer_groups": 0, "reg_dec_producer": 0, "reg_inc_consumer": 0}, "(8, 2048, 11008, 64, 8)": {"BLOCK_SIZE_M": 16, "BLOCK_SIZE_N": 32, "BLOCK_SIZE_K": 32, "GROUP_SIZE_M": 8, "SPLIT_K": 8, "A_load_order": 2, "meta_evict_policy": "", "atomic_mode": "relaxed", "num_warps": 4, "num_ctas": 1, "num_stages": 1, "num_buffers_warp_spec": 0, "num_consumer_groups": 0, "reg_dec_producer": 0, "reg_inc_consumer": 0}, "(4, 2560, 2048, 64, 8)": {"BLOCK_SIZE_M": 16, "BLOCK_SIZE_N": 64, "BLOCK_SIZE_K": 64, "GROUP_SIZE_M": 8, "SPLIT_K": 16, "A_load_order": 0, "meta_evict_policy": "", "atomic_mode": "relaxed", "num_warps": 4, "num_ctas": 1, "num_stages": 1, "num_buffers_warp_spec": 0, "num_consumer_groups": 0, "reg_dec_producer": 0, "reg_inc_consumer": 0}, "(4, 2048, 2048, 64, 8)": {"BLOCK_SIZE_M": 16, "BLOCK_SIZE_N": 64, "BLOCK_SIZE_K": 64, "GROUP_SIZE_M": 8, "SPLIT_K": 16, "A_load_order": 2, "meta_evict_policy": "", "atomic_mode": "relaxed", "num_warps": 4, "num_ctas": 1, "num_stages": 1, "num_buffers_warp_spec": 0, "num_consumer_groups": 0, "reg_dec_producer": 0, "reg_inc_consumer": 0}, "(4, 22016, 2048, 64, 8)": {"BLOCK_SIZE_M": 16, "BLOCK_SIZE_N": 64, "BLOCK_SIZE_K": 64, "GROUP_SIZE_M": 8, "SPLIT_K": 16, "A_load_order": 2, "meta_evict_policy": "", "atomic_mode": "relaxed", "num_warps": 4, "num_ctas": 1, "num_stages": 1, "num_buffers_warp_spec": 0, "num_consumer_groups": 0, "reg_dec_producer": 0, "reg_inc_consumer": 0}, "(4, 2048, 11008, 64, 8)": {"BLOCK_SIZE_M": 16, "BLOCK_SIZE_N": 32, "BLOCK_SIZE_K": 32, "GROUP_SIZE_M": 8, "SPLIT_K": 8, "A_load_order": 2, "meta_evict_policy": "", "atomic_mode": "relaxed", "num_warps": 4, "num_ctas": 1, "num_stages": 1, "num_buffers_warp_spec": 0, "num_consumer_groups": 0, "reg_dec_producer": 0, "reg_inc_consumer": 0}, "(2, 2560, 2048, 64, 8)": {"BLOCK_SIZE_M": 16, "BLOCK_SIZE_N": 64, "BLOCK_SIZE_K": 32, "GROUP_SIZE_M": 8, "SPLIT_K": 16, "A_load_order": 2, "meta_evict_policy": "", "atomic_mode": "relaxed", "num_warps": 4, "num_ctas": 1, "num_stages": 1, "num_buffers_warp_spec": 0, "num_consumer_groups": 0, "reg_dec_producer": 0, "reg_inc_consumer": 0}, "(2, 2048, 2048, 64, 8)": {"BLOCK_SIZE_M": 16, "BLOCK_SIZE_N": 64, "BLOCK_SIZE_K": 64, "GROUP_SIZE_M": 8, "SPLIT_K": 16, "A_load_order": 2, "meta_evict_policy": "", "atomic_mode": "relaxed", "num_warps": 4, "num_ctas": 1, "num_stages": 1, "num_buffers_warp_spec": 0, "num_consumer_groups": 0, "reg_dec_producer": 0, "reg_inc_consumer": 0}, "(2, 22016, 2048, 64, 8)": {"BLOCK_SIZE_M": 16, "BLOCK_SIZE_N": 64, "BLOCK_SIZE_K": 64, "GROUP_SIZE_M": 8, "SPLIT_K": 16, "A_load_order": 2, "meta_evict_policy": "", "atomic_mode": "relaxed", "num_warps": 4, "num_ctas": 1, "num_stages": 1, "num_buffers_warp_spec": 0, "num_consumer_groups": 0, "reg_dec_producer": 0, "reg_inc_consumer": 0}, "(2, 2048, 11008, 64, 8)": {"BLOCK_SIZE_M": 16, "BLOCK_SIZE_N": 32, "BLOCK_SIZE_K": 32, "GROUP_SIZE_M": 8, "SPLIT_K": 8, "A_load_order": 2, "meta_evict_policy": "", "atomic_mode": "relaxed", "num_warps": 4, "num_ctas": 1, "num_stages": 1, "num_buffers_warp_spec": 0, "num_consumer_groups": 0, "reg_dec_producer": 0, "reg_inc_consumer": 0}}, "GEMM": {"(1024, 2560, 2048, 64, 8)": {"BLOCK_SIZE_M": 64, "BLOCK_SIZE_N": 128, "BLOCK_SIZE_K": 32, "GROUP_SIZE_M": 8, "A_load_order": 2, "meta_evict_policy": "", "num_warps": 8, "num_ctas": 1, "num_stages": 1, "num_buffers_warp_spec": 0, "num_consumer_groups": 0, "reg_dec_producer": 0, "reg_inc_consumer": 0}, "(1024, 2048, 2048, 64, 8)": {"BLOCK_SIZE_M": 64, "BLOCK_SIZE_N": 128, "BLOCK_SIZE_K": 32, "GROUP_SIZE_M": 8, "A_load_order": 2, "meta_evict_policy": "", "num_warps": 8, "num_ctas": 1, "num_stages": 1, "num_buffers_warp_spec": 0, "num_consumer_groups": 0, "reg_dec_producer": 0, "reg_inc_consumer": 0}, "(1024, 22016, 2048, 64, 8)": {"BLOCK_SIZE_M": 64, "BLOCK_SIZE_N": 128, "BLOCK_SIZE_K": 32, "GROUP_SIZE_M": 8, "A_load_order": 2, "meta_evict_policy": "", "num_warps": 8, "num_ctas": 1, "num_stages": 1, "num_buffers_warp_spec": 0, "num_consumer_groups": 0, "reg_dec_producer": 0, "reg_inc_consumer": 0}, "(1024, 2048, 11008, 64, 8)": {"BLOCK_SIZE_M": 64, "BLOCK_SIZE_N": 256, "BLOCK_SIZE_K": 32, "GROUP_SIZE_M": 8, "A_load_order": 2, "meta_evict_policy": "", "num_warps": 4, "num_ctas": 1, "num_stages": 1, "num_buffers_warp_spec": 0, "num_consumer_groups": 0, "reg_dec_producer": 0, "reg_inc_consumer": 0}, "(256, 2560, 2048, 64, 8)": {"BLOCK_SIZE_M": 64, "BLOCK_SIZE_N": 64, "BLOCK_SIZE_K": 64, "GROUP_SIZE_M": 8, "A_load_order": 2, "meta_evict_policy": "", "num_warps": 8, "num_ctas": 1, "num_stages": 1, "num_buffers_warp_spec": 0, "num_consumer_groups": 0, "reg_dec_producer": 0, "reg_inc_consumer": 0}, "(256, 2048, 2048, 64, 8)": {"BLOCK_SIZE_M": 64, "BLOCK_SIZE_N": 64, "BLOCK_SIZE_K": 64, "GROUP_SIZE_M": 8, "A_load_order": 2, "meta_evict_policy": "", "num_warps": 8, "num_ctas": 1, "num_stages": 1, "num_buffers_warp_spec": 0, "num_consumer_groups": 0, "reg_dec_producer": 0, "reg_inc_consumer": 0}, "(256, 22016, 2048, 64, 8)": {"BLOCK_SIZE_M": 64, "BLOCK_SIZE_N": 128, "BLOCK_SIZE_K": 32, "GROUP_SIZE_M": 8, "A_load_order": 2, "meta_evict_policy": "", "num_warps": 8, "num_ctas": 1, "num_stages": 1, "num_buffers_warp_spec": 0, "num_consumer_groups": 0, "reg_dec_producer": 0, "reg_inc_consumer": 0}, "(256, 2048, 11008, 64, 8)": {"BLOCK_SIZE_M": 64, "BLOCK_SIZE_N": 64, "BLOCK_SIZE_K": 64, "GROUP_SIZE_M": 8, "A_load_order": 2, "meta_evict_policy": "", "num_warps": 8, "num_ctas": 1, "num_stages": 1, "num_buffers_warp_spec": 0, "num_consumer_groups": 0, "reg_dec_producer": 0, "reg_inc_consumer": 0}, "(128, 2560, 2048, 64, 8)": {"BLOCK_SIZE_M": 64, "BLOCK_SIZE_N": 32, "BLOCK_SIZE_K": 64, "GROUP_SIZE_M": 8, "A_load_order": 2, "meta_evict_policy": "", "num_warps": 8, "num_ctas": 1, "num_stages": 1, "num_buffers_warp_spec": 0, "num_consumer_groups": 0, "reg_dec_producer": 0, "reg_inc_consumer": 0}, "(128, 2048, 2048, 64, 8)": {"BLOCK_SIZE_M": 64, "BLOCK_SIZE_N": 32, "BLOCK_SIZE_K": 64, "GROUP_SIZE_M": 8, "A_load_order": 2, "meta_evict_policy": "", "num_warps": 8, "num_ctas": 1, "num_stages": 1, "num_buffers_warp_spec": 0, "num_consumer_groups": 0, "reg_dec_producer": 0, "reg_inc_consumer": 0}, "(128, 22016, 2048, 64, 8)": {"BLOCK_SIZE_M": 64, "BLOCK_SIZE_N": 64, "BLOCK_SIZE_K": 64, "GROUP_SIZE_M": 8, "A_load_order": 2, "meta_evict_policy": "", "num_warps": 4, "num_ctas": 1, "num_stages": 1, "num_buffers_warp_spec": 0, "num_consumer_groups": 0, "reg_dec_producer": 0, "reg_inc_consumer": 0}, "(128, 2048, 11008, 64, 8)": {"BLOCK_SIZE_M": 64, "BLOCK_SIZE_N": 32, "BLOCK_SIZE_K": 64, "GROUP_SIZE_M": 8, "A_load_order": 2, "meta_evict_policy": "", "num_warps": 8, "num_ctas": 1, "num_stages": 1, "num_buffers_warp_spec": 0, "num_consumer_groups": 0, "reg_dec_producer": 0, "reg_inc_consumer": 0}, "(512, 2560, 2048, 64, 8)": {"BLOCK_SIZE_M": 64, "BLOCK_SIZE_N": 64, "BLOCK_SIZE_K": 64, "GROUP_SIZE_M": 8, "A_load_order": 2, "meta_evict_policy": "", "num_warps": 4, "num_ctas": 1, "num_stages": 1, "num_buffers_warp_spec": 0, "num_consumer_groups": 0, "reg_dec_producer": 0, "reg_inc_consumer": 0}, "(512, 2048, 2048, 64, 8)": {"BLOCK_SIZE_M": 64, "BLOCK_SIZE_N": 64, "BLOCK_SIZE_K": 64, "GROUP_SIZE_M": 8, "A_load_order": 2, "meta_evict_policy": "", "num_warps": 8, "num_ctas": 1, "num_stages": 1, "num_buffers_warp_spec": 0, "num_consumer_groups": 0, "reg_dec_producer": 0, "reg_inc_consumer": 0}, "(512, 22016, 2048, 64, 8)": {"BLOCK_SIZE_M": 64, "BLOCK_SIZE_N": 128, "BLOCK_SIZE_K": 32, "GROUP_SIZE_M": 8, "A_load_order": 2, "meta_evict_policy": "", "num_warps": 8, "num_ctas": 1, "num_stages": 1, "num_buffers_warp_spec": 0, "num_consumer_groups": 0, "reg_dec_producer": 0, "reg_inc_consumer": 0}, "(512, 2048, 11008, 64, 8)": {"BLOCK_SIZE_M": 64, "BLOCK_SIZE_N": 64, "BLOCK_SIZE_K": 64, "GROUP_SIZE_M": 8, "A_load_order": 2, "meta_evict_policy": "", "num_warps": 8, "num_ctas": 1, "num_stages": 1, "num_buffers_warp_spec": 0, "num_consumer_groups": 0, "reg_dec_producer": 0, "reg_inc_consumer": 0}}}